{
  "$schema": "https://json-schema.org/draft/2020-12/schema",
  "$id": "https://raw.githubusercontent.com/sheepxux/SuperLoop/v2.0.0/protocol/evaluator.schema.json",
  "title": "Evaluator Result",
  "type": "object",
  "additionalProperties": false,
  "required": ["apiVersion", "loop", "itemId", "evaluator", "verdict", "evidence", "reasons"],
  "properties": {
    "apiVersion": { "type": "string", "const": "superloop/v2" },
    "loop": { "type": "string", "minLength": 1 },
    "itemId": { "type": "string", "minLength": 1 },
    "partDefinitionSha256": {
      "type": "string",
      "pattern": "^[a-f0-9]{64}$"
    },
    "evaluator": {
      "type": "object",
      "additionalProperties": false,
      "required": ["identity", "contextId", "evaluatedAt"],
      "properties": {
        "identity": { "type": "string", "minLength": 1 },
        "contextId": { "type": "string", "minLength": 1 },
        "evaluatedAt": { "type": "string", "minLength": 20 }
      }
    },
    "verdict": {
      "type": "string",
      "enum": ["pass", "fail", "blocked", "needs-human"]
    },
    "evidence": {
      "type": "array",
      "minItems": 1,
      "items": {
        "type": "object",
        "additionalProperties": false,
        "required": ["type", "summary"],
        "properties": {
          "type": { "type": "string", "minLength": 1 },
          "summary": { "type": "string", "minLength": 1 },
          "path": { "type": "string", "minLength": 1 },
          "sha256": { "type": "string", "pattern": "^[a-f0-9]{64}$" },
          "command": { "type": "string", "minLength": 1 },
          "exitCode": { "type": ["integer", "null"] }
        }
      }
    },
    "reasons": {
      "type": "array",
      "items": { "type": "string", "minLength": 1 }
    },
    "criteria": {
      "type": "array",
      "minItems": 1,
      "items": {
        "type": "object",
        "additionalProperties": false,
        "required": ["id", "verdict", "summary"],
        "properties": {
          "id": { "type": "string", "minLength": 1 },
          "verdict": {
            "type": "string",
            "enum": ["pass", "fail"]
          },
          "summary": { "type": "string", "minLength": 1 }
        }
      }
    },
    "artifacts": {
      "type": "array",
      "items": {
        "$ref": "#/$defs/artifactBinding"
      }
    },
    "nextAction": {
      "type": "string",
      "enum": ["accept", "retry", "move-to-inbox", "ask-human"]
    }
  },
  "$defs": {
    "artifactBinding": {
      "type": "object",
      "additionalProperties": false,
      "required": ["id", "reference", "sha256"],
      "properties": {
        "id": { "type": "string", "minLength": 1 },
        "reference": { "type": "string", "minLength": 1 },
        "sha256": { "type": "string", "pattern": "^[a-f0-9]{64}$" }
      }
    }
  }
}
