{
  "apiVersion": "superloop/v2",
  "loop": "example-loop",
  "itemId": "item-001",
  "evaluator": {
    "identity": "independent-evaluator",
    "contextId": "eval-example-001",
    "evaluatedAt": "2026-07-11T00:00:00Z"
  },
  "verdict": "fail",
  "evidence": [
    {
      "type": "diff-review",
      "summary": "Evaluator reviewed the patch and found missing test evidence."
    }
  ],
  "reasons": [
    "Required test evidence is missing."
  ],
  "nextAction": "retry"
}
